{
  "dataset_id": "e6441e60369f6045",
  "dataset_version": 2,
  "schema_version": 3,
  "content_hash": "e1d92523c2104231012a6308b3666fda9f27296f45ba18ef143f91c1170c17e3",
  "known_as_of_utc": "2026-09-18T03:04:05.5+00:00",
  "adjusted": true,
  "announcement_policy": "strict",
  "universe_code": "VN30",
  "universe_as_of": null,
  "instruments": [
    {
      "instrument_id": "0f3c1a52-7d10-4c6e-9a0b-1d2e3f405161",
      "ticker_at_as_of": "AAA",
      "exchange": "HOSE",
      "spells": [
        {
          "from": "2026-07-01",
          "until": null,
          "announced_on": "2025-07-17",
          "removal_announced_on": null
        }
      ],
      "history_from": "2025-06-25"
    },
    {
      "instrument_id": "1a2b3c4d-5e6f-4a7b-8c9d-0e1f2a3b4c5d",
      "ticker_at_as_of": "BBB",
      "exchange": "HOSE",
      "spells": [
        {
          "from": "2026-08-03",
          "until": null,
          "announced_on": "2026-07-15",
          "removal_announced_on": null
        }
      ],
      "history_from": "2025-07-28"
    },
    {
      "instrument_id": "2b3c4d5e-6f70-4b8c-9dae-bf0011223344",
      "ticker_at_as_of": "CCC",
      "exchange": "HNX",
      "spells": [
        {
          "from": "2026-07-01",
          "until": "2026-08-03",
          "announced_on": "2025-07-17",
          "removal_announced_on": "2026-07-15"
        }
      ],
      "history_from": "2025-06-25"
    },
    {
      "instrument_id": "3c4d5e6f-7081-4c9d-aebf-c01122334455",
      "ticker_at_as_of": "DDD",
      "exchange": "HOSE",
      "spells": [
        {
          "from": "2026-07-01",
          "until": "2026-07-20",
          "announced_on": null,
          "removal_announced_on": null
        },
        {
          "from": "2026-08-03",
          "until": null,
          "announced_on": "2026-07-15",
          "removal_announced_on": null
        }
      ],
      "history_from": "2025-06-25"
    },
    {
      "instrument_id": "4d5e6f70-8192-4dae-bfc0-d12233445566",
      "ticker_at_as_of": "EEE",
      "exchange": "UPCOM",
      "spells": [
        {
          "from": "2026-07-01",
          "until": null,
          "announced_on": "2025-07-17",
          "removal_announced_on": null
        }
      ],
      "history_from": null
    }
  ],
  "interval": "1d",
  "from_date": "2026-07-01",
  "to_date": "2026-09-17",
  "transformation_version": 1,
  "validation_version": 1,
  "adjustment_version": 2,
  "sources": [
    {
      "code": "CAFEF",
      "licence_note": "No licence granted. Retained under the absence of a prohibition rather than a permission. Not for redistribution."
    }
  ],
  "files": [
    {
      "name": "bars.parquet",
      "row_count": 1265,
      "bytes": 41000,
      "sha256": "5555555555555555555555555555555555555555555555555555555555555555"
    }
  ],
  "created_at_utc": "2026-10-11T00:00:00+00:00",
  "created_by_commit": null,
  "membership": "point_in_time",
  "history_sessions": 253,
  "row_count": 1265
}
